ID,Slug,Make,Model,Year,Price,Currency,Price Display,Price Million,Mileage,Body Type,Engine,VIN,Source,Status,Featured,Description,Image 1,Image 2,Image 3,Image 4,Image 5,Image 6,Pros 1,Pros 2,Pros 3,Cons 1,Cons 2,Cons 3
1,"2024-mercedes-benz-c200-amg-line","Mercedes-Benz","C200 AMG Line (W206)",2024,43831914,LKR,"LKR 44,800,000 upwards","(44.8 Million LKR upwards)",low,"Sedan","1.5L 4-Cylinder Turbo MHEV",W1KAF4CB1R,"UK Import",Available,true,"A stunning 2024 Mercedes-Benz C200 AMG Line, combining the iconic S-Class luxury with sporty AMG styling. This mild-hybrid (MHEVA) model features a 1.5L turbocharged engine (1496CC) providing brisk performance and efficiency. The cabin is dominated by the latest MBUX vertical touchscreen and a digital driver's display. Imported from UK.","/1/front.jpg","/1/back.jpg","/1/side.jpg","/1/inside.jpg","/1/inside2.jpg","/1/front2.jpg","Interior technology and luxury feel are best-in-class.","AMG Line package provides a sharp, aggressive exterior.","Mild-hybrid system offers smooth acceleration and good fuel economy.","AMG sports suspension offers a responsive and engaging ride, which may feel firm to some.","Features a modern, minimalist cabin design with most controls integrated into the central touchscreen.",""
2,"2025-land-rover-defender-110-p300e","Land Rover","Defender 110 P300e",2025,71900285,LKR,"LKR 72,900,000 upwards","(72.9 Million LKR upwards)",low,"SUV","2.0L 4-Cylinder PHEV",SALEA7AX5,"UK Import",Available,true,"This is the 2025 Defender 110 P300e, the plug-in hybrid that combines legendary off-road capability with silent, zero-emission electric driving. Its 2.0L petrol engine and electric motor provide instant torque and a usable all-electric range for city commutes. This 'Sedona' edition is ready for any adventure, from the urban jungle to the actual jungle.","https://images.pexels.com/photos/5702450/pexels-photo-5702450.jpeg?auto=compress&cs=tinysrgb&w=1260&h=750&dpr=1","https://images.pexels.com/photos/1164778/pexels-photo-1164778.jpeg?auto=compress&cs=tinysrgb&w=1260&h=750&dpr=1","https://images.pexels.com/photos/707046/pexels-photo-707046.jpeg?auto=compress&cs=tinysrgb&w=1260&h=750&dpr=1","https://images.pexels.com/photos/170811/pexels-photo-170811.jpeg?auto=compress&cs=tinysrgb&w=1260&h=750&dpr=1","https://images.pexels.com/photos/112460/pexels-photo-112460.jpeg?auto=compress&cs=tinysrgb&w=1260&h=750&dpr=1","","Unstoppable off-road prowess with air suspension and advanced terrain modes.","Ability to drive on pure electric power for silent, emission-free trips.","Iconic, rugged design that is both modern and timeless.","The advanced PHEV system contributes to a stable and planted feel on the road.","Electric range is optimized for city commutes and daily errands.","Pivi Pro infotainment system is feature-rich, with many advanced options to explore."
3,"2025-range-rover-p460e-autobiography","Range Rover","P460e Autobiography",2025,124312373,LKR,"LKR 125,300,000 upwards","(125.3 Million LKR upwards)",low,"SUV","3.0L 6-Cylinder PHEV",SALKABA40S,"UK Import",Available,true,"The absolute pinnacle of luxury. This 2025 Range Rover P460e Autobiography is the long-wheelbase plug-in hybrid, offering unparalleled comfort and refinement. Its 3.0L (2996CC) straight-six engine and electric motor deliver 460PS of effortless power. The Autobiography trim includes executive rear seating, premium leather, and every conceivable modern luxury.","https://images.pexels.com/photos/3771836/pexels-photo-3771836.jpeg?auto=compress&cs=tinysrgb&w=1260&h=750&dpr=1","https://images.pexels.com/photos/1164778/pexels-photo-1164778.jpeg?auto=compress&cs=tinysrgb&w=1260&h=750&dpr=1","https://images.pexels.com/photos/707046/pexels-photo-707046.jpeg?auto=compress&cs=tinysrgb&w=1260&h=750&dpr=1","https://images.pexels.com/photos/170811/pexels-photo-170811.jpeg?auto=compress&cs=tinysrgb&w=1260&h=750&dpr=1","https://images.pexels.com/photos/112460/pexels-photo-112460.jpeg?auto=compress&cs=tinysrgb&w=1260&h=750&dpr=1","","One of the most luxurious and quietest cabins on the market.","Impressive real-world electric range for a vehicle of this size.","Four-wheel steering makes it surprisingly maneuverable in tight spaces.","Represents the pinnacle of luxury, with ownership costs reflecting its first-class status.","A commanding presence on the road; four-wheel steering provides excellent maneuverability for its size.",""
4,"2023-suzuki-every-join-van","Suzuki","Every Join",2023,6860682,LKR,"LKR 7,360,000 upwards","(7.36 Million LKR upwards)",low,"Van","660cc 3-Cylinder Petrol",DA17V,"Japan Import",Available,false,"The perfect compact utility vehicle. This 2023 Suzuki Every Join is a Japanese 'Kei' van, designed for maximum space and efficiency. Powered by a frugal 660cc 3-cylinder engine (R06A), it's incredibly economical to run and maintain. The 'Join' model is a higher-spec version with more comfortable rear seats and interior trim, making it ideal for both business and personal use.","https://images.pexels.com/photos/3807384/pexels-photo-3807384.jpeg?auto=compress&cs=tinysrgb&w=1260&h=750&dpr=1","https://images.pexels.com/photos/1164778/pexels-photo-1164778.jpeg?auto=compress&cs=tinysrgb&w=1260&h=750&dpr=1","https://images.pexels.com/photos/707046/pexels-photo-707046.jpeg?auto=compress&cs=tinysrgb&w=1260&h=750&dpr=1","https://images.pexels.com/photos/170811/pexels-photo-170811.jpeg?auto=compress&cs=tinysrgb&w=1260&h=750&dpr=1","https://images.pexels.com/photos/112460/pexels-photo-112460.jpeg?auto=compress&cs=tinysrgb&w=1260&h=750&dpr=1","","Exceptional fuel economy and low running costs.","Incredibly spacious and versatile cargo area for its tiny footprint.","Tight turning radius makes it perfect for narrow city streets.","Engine is expertly optimized for city driving and maximum fuel efficiency.","Emphasizes practical, utilitarian design and straightforward, easy-to-use controls.","High, boxy design maximizes interior space and visibility."
5,"2025-mercedes-benz-gle-400e-hybrid","Mercedes-Benz","GLE 400e 4MATIC",2025,73924146,LKR,"LKR 74,900,000 upwards","(74.9 Million LKR upwards)",low,"SUV","2.0L 4-Cylinder PHEV",W1NFB4GB7S,"UK Import",Available,true,"A 2025 Mercedes-Benz GLE 400e Plug-in Hybrid, direct from the UK. This luxury SUV pairs a 2.0L (1999CC) turbocharged engine with a powerful electric motor for a combined 381 hp and 4MATIC all-wheel drive. It offers a substantial electric-only range, perfect for emission-free daily driving, while the opulent, high-tech interior ensures every journey is a first-class experience.","https://images.pexels.com/photos/136872/pexels-photo-136872.jpeg?auto=compress&cs=tinysrgb&w=1260&h=750&dpr=1","https://images.pexels.com/photos/1164778/pexels-photo-1164778.jpeg?auto=compress&cs=tinysrgb&w=1260&h=750&dpr=1","https://images.pexels.com/photos/707046/pexels-photo-707046.jpeg?auto=compress&cs=tinysrgb&w=1260&h=750&dpr=1","https://images.pexels.com/photos/170811/pexels-photo-170811.jpeg?auto=compress&cs=tinysrgb&w=1260&h=750&dpr=1","https://images.pexels.com/photos/112460/pexels-photo-112460.jpeg?auto=compress&cs=tinysrgb&w=1260&h=750&dpr=1","","Spacious, quiet, and exceptionally well-built cabin.","Excellent plug-in hybrid system with a strong electric motor and decent EV range.","Airmatic suspension (if equipped) provides a supremely comfortable ride.","Solid, heavyweight construction provides a secure and exceptionally stable ride.","Hybrid system prioritizes electric torque, with the petrol engine providing support when needed.","Cabin is packed with a wide array of advanced Mercedes-Benz technologies."
6,"2025-honda-vezel-ehev-z-play","Honda","Vezel e:HEV Z Play",2025,16036394,LKR,"LKR 17,036,394 upwards","(17.0 Million LKR upwards)",low,"SUV","1.5L 4-Cylinder e:HEV Hybrid",RV5,"Japan Import",Available,true,"Introducing the 2025 Honda Vezel e:HEV (Hybrid), 'Z Play' package. This top-tier model features a 1.5L (1496CC) intelligent hybrid system that provides responsive acceleration and incredible fuel efficiency. The 'Play' package adds unique exterior color accents, a premium audio system, and a panoramic sunroof. It also includes Honda's 'Magic Seats' for unmatched interior versatility.","https://images.pexels.com/photos/244206/pexels-photo-244206.jpeg?auto=compress&cs=tinysrgb&w=1260&h=750&dpr=1","https://images.pexels.com/photos/1164778/pexels-photo-1164778.jpeg?auto=compress&cs=tinysrgb&w=1260&h=750&dpr=1","https://images.pexels.com/photos/707046/pexels-photo-707046.jpeg?auto=compress&cs=tinysrgb&w=1260&h=750&dpr=1","https://images.pexels.com/photos/170811/pexels-photo-170811.jpeg?auto=compress&cs=tinysrgb&w=1260&h=750&dpr=1","https://images.pexels.com/photos/112460/pexels-photo-112460.jpeg?auto=compress&cs=tinysrgb&w=1260&h=750&dpr=1","","Highly efficient e:HEV system is smooth and economical in city driving.","Brilliant 'Magic Seat' system offers class-leading cargo flexibility.","Modern, minimalist interior design with high-quality materials.","e:HEV system is engineered for quiet, electric-like response in town.","Stylish, coupe-like roofline gives the vehicle a sporty and modern profile.",""
7,"2024-toyota-raize-e-smart-hybrid","Toyota","Raize e-SMART Hybrid",2024,12995066,LKR,"LKR 13,500,000 upwards","(13.5 Million LKR upwards)",low,"SUV","1.2L 3-Cylinder Series Hybrid",A202A,"Japan Import",Available,false,"A 2024 Toyota Raize featuring the innovative e-SMART Hybrid system. This compact SUV is 100% electric-driven, with its 1.2L (1196CC) 3-cylinder petrol engine acting solely as a generator to charge the battery. This provides an EV-like driving experience with instant torque and a very smooth ride, without any range anxiety. Perfect for efficient and responsive city driving.","https://images.pexels.com/photos/170811/pexels-photo-170811.jpeg?auto=compress&cs=tinysrgb&w=1260&h=750&dpr=1","https://images.pexels.com/photos/1164778/pexels-photo-1164778.jpeg?auto=compress&cs=tinysrgb&w=1260&h=750&dpr=1","https://images.pexels.com/photos/707046/pexels-photo-707046.jpeg?auto=compress&cs=tinysrgb&w=1260&h=750&dpr=1","https://images.pexels.com/photos/112460/pexels-photo-112460.jpeg?auto=compress&cs=tinysrgb&w=1260&h=750&dpr=1","https://images.pexels.com/photos/97353/pexels-photo-97353.jpeg?auto=compress&cs=tinysrgb&w=1260&h=750&dpr=1","","Series hybrid system provides a smooth, EV-like driving feel.","Excellent fuel economy as the engine always runs at its most efficient RPM.","Compact footprint with a surprisingly spacious and practical interior.","e-SMART system intelligently uses the generator engine to ensure the battery is always ready.","Interior is finished with durable, hard-wearing materials perfect for a practical daily-use vehicle.","Powertrain is specialized for outstanding efficiency and responsiveness in city environments."
8,"2025-toyota-yaris-ativ-hybrid","Toyota","Yaris Ativ e:HEV",2025,15456818,LKR,"LKR 16,156,818 upwards","(16.1 Million LKR upwards)",low,"Sedan","1.5L 4-Cylinder e:HEV Hybrid",MR787B0310,"Thailand Import",Available,false,"This 2025 Toyota Yaris Ativ (also known as Vios) is the all-new hybrid model imported from Thailand. It features a highly efficient 1.5L (1496CC) e:HEV system, shared with other modern Toyotas. With its sharp, fastback-inspired design, premium interior, and a full suite of Toyota Safety Sense features, the Yaris Ativ is a leader in the compact sedan class.","https://images.pexels.com/photos/116675/pexels-photo-116675.jpeg?auto=compress&cs=tinysrgb&w=1260&h=750&dpr=1","https://images.pexels.com/photos/1164778/pexels-photo-1164778.jpeg?auto=compress&cs=tinysrgb&w=1260&h=750&dpr=1","https://images.pexels.com/photos/707046/pexels-photo-707046.jpeg?auto=compress&cs=tinysrgb&w=1260&h=750&dpr=1","https://images.pexels.com/photos/170811/pexels-photo-170811.jpeg?auto=compress&cs=tinysrgb&w=1260&h=750&dpr=1","https://images.pexels.com/photos/112460/pexels-photo-112460.jpeg?auto=compress&cs=tinysrgb&w=1260&h=750&dpr=1","","Aggressive, stylish design that looks more expensive than it is.","Proven Toyota hybrid system delivers outstanding fuel economy.","Modern interior with features like a large touchscreen and digital dash.","Features a sleek, fastback-style roofline for a sporty and aerodynamic look.","CVT transmission is tuned for maximum fuel efficiency and smooth, linear power delivery.",""